### ISSUE TITLE
Why i can't capture any packets?

### ISSUE THREAD

**Issue by marshalWS** [cloudflare/xdpcap#36]
**Hi！
here are codes and operators.**

`//xdp-pass-ebpf.c 
#include <linux/bpf.h>
#include <linux/if_ether.h>
#include <linux/in.h>
#include <linux/ip.h>
#include <linux/ipv6.h>
#include <linux/udp.h>

#include <stdint.h>

#define SEC(NAME) __attribute__((section(NAME), used))

#define htons(x) ((__be16)___constant_swab16((x)))
#define htonl(x) ((__be32)___constant_swab32((x)))

#define PIN_GLOBAL_NS           2

struct bpf_elf_map {
        __u32 type;
        __u32 size_key;
        __u32 size_value;
        __u32 max_elem;
        __u32 flags;
        __u32 id;
        __u32 pinning;
};

struct bpf_elf_map SEC("maps") action_map = {
        .type = BPF_MAP_TYPE_PROG_ARRAY,
        .size_key = sizeof(int),
        .size_value = sizeof(int),
        .pinning        = PIN_GLOBAL_NS,
        .max_elem = 100,
};

struct vlan_hdr {
        __be16 h_vlan_TCI;
        __be16 h_vlan_encapsulated_proto;
};

SEC("prog")
int xdp_pass_benchmark_traffic(struct xdp_md *ctx)
{

        return XDP_PASS;
}

char _license[] SEC("license") = "GPL";
`

//set xdp obj to nic

root@xxx:/home/tttt/bin# `ip link set dev ens3 xdp obj xdp-pass-ebpf.o`
Note: 8 bytes struct bpf_elf_map fixup performed due to size mismatch!
root@xxx:/home/tttt/bin#

**//show dev
root@xxx:/home/tttt/bin# `ip link show dev ens3`**
2: ens3: <BROADCAST,MULTICAST> mtu 1500 xdp qdisc mq state DOWN mode DEFAULT group default qlen 1000
    link/ether fa:16:3e:b6:9e:8f brd ff:ff:ff:ff:ff:ff
    prog/xdp id 8 tag 3b185187f1855c4c jited

**//pinned map
root@xxx:/sys/fs/bpf/xdp/globals#`  ll /sys/fs/bpf/xdp/globals/action_map`**
-rw------- 1 root root 0 12月 16 23:24 /sys/fs/bpf/xdp/globals/action_map
root@xxx:/sys/fs/bpf/xdp/globals#

**//ping 168.168.208.36 --> 168.168.208.37**
64 bytes from 168.168.208.36: icmp_seq=180 ttl=64 time=0.305 ms
64 bytes from 168.168.208.36: icmp_seq=181 ttl=64 time=0.328 ms
64 bytes from 168.168.208.36: icmp_seq=182 ttl=64 time=0.335 ms
64 bytes from 168.168.208.36: icmp_seq=183 ttl=64 time=0.288 ms

**//capture  -- why i can't any packets ,  action is  xdp_pass**
root@xxx:/home/tttt/bin# `./xdpcap /sys/fs/bpf/xdp/globals/action_map  dump.pcap`
ws-----   os.Args[0]= ./xdpcap   [1:]= [/sys/fs/bpf/xdp/globals/action_map dump.pcap]
aborted: 0/0    drop: 0/0       pass: 0/0       tx: 0/0 redirect: 0/0   xdpAction(5): 0/0       xdpAction(6): 0/0    xdpAction(7): 0/0       xdpAction(8): 0/0       xdpAction(9): 0/0       xdpAction(10): 0/0   xdpAction(11): 0/0      xdpAction(12): 0/0      xdpAction(13): 0/0      xdpAction(14): 0/0  xdpAction(15): 0/0       xdpAction(16): 0/0      xdpAction(17): 0/0      xdpAction(18): 0/0      xdpAction(19): 0/0   xdpAction(20): 0/0      xdpAction(21): 0/0      xdpAction(22): 0/0      xdpAction(23): 0/0   xdpAction(24): 0/0      xdpAction(25): 0/0      xdpAction(26): 0/0      xdpAction(27): 0/0  xdpAction(28): 0/0       xdpAction(29): 0/0      xdpAction(30): 0/0      xdpAction(31): 0/0      xdpAction(32): 0/0   xdpAction(33): 0/0      xdpAction(34): 0/0      xdpAction(35): 0/0      xdpAction(36): 0/0   xdpAction(37): 0/0      xdpAction(38): 0/0      xdpAction(39): 0/0      xdpAction(40): 0/0  x

**//but tcpdump can find packets on ens3**
root@xxx:/home/tttt/bin# `tcpdump -i ens3`
tcpdump: verbose output suppressed, use -v or -vv for full protocol decode
listening on ens3, link-type EN10MB (Ethernet), capture size 262144 bytes
23:36:04.136424 IP 168.168.208.37 > xxx: ICMP echo request, id 1259, seq 1, length 64
23:36:04.136472 IP xxx > 168.168.208.37: ICMP echo reply, id 1259, seq 1, length 64
23:36:05.151978 IP 168.168.208.37 > xxx: ICMP echo request, id 1259, seq 2, length 64
23:36:05.152015 IP xxx > 168.168.208.37: ICMP echo reply, id 1259, seq 2, length 64
23:36:06.175955 IP 168.168.208.37 > xxx: ICMP echo request, id 1259, seq 3, length 64
23:36:06.175998 IP xxx > 168.168.208.37: ICMP echo reply, id 1259, seq 3, length 64
6 packets captured

root@xxx:/home/tttt/bin# **ifconfig ens3**
ens3      Link encap:Ethernet  HWaddr fa:16:3e:b6:9e:8f
          inet addr:168.168.208.36  Bcast:168.168.208.255  Mask:255.255.255.0
          inet6 addr: fe80::f816:3eff:feb6:9e8f/64 Scope:Link
          UP BROADCAST RUNNING MULTICAST  MTU:1500  Metric:1
          **RX packets:1254** errors:0 dropped:0 overruns:0 frame:0
          **TX packets:1345** errors:0 dropped:0 overruns:0 carrier:0
          collisions:0 txqueuelen:1000
          RX bytes:120679 (120.6 KB)  TX bytes:130643 (130.6 KB)

root@xxx:/home/tttt/bin#

**Comment by marshalWS** [comment]
what's mean with  Note: 8 bytes struct bpf_elf_map fixup performed due to size mismatch!？

root@tecs-OpenStack-Nova:/home/tecs/bin# ip link set dev ens3 xdp obj xdp-pass-ebpf.o
`Note: 8 bytes struct bpf_elf_map fixup performed due to size mismatch!`
root@tecs-OpenStack-Nova:/home/tecs/bin#

**Comment by arthurfabre** [comment]
Thanks for the example, I didn't realize that maps could be pinned with `ip link set xdp`.

The only problem I can spot is that your program doesn't `tail_call` into the map. Instead of:

```
    return XDP_PASS;
```

You need to:

```
#include "hook.h"

...

    return xdpcap_exit(ctx, &bpf_elf_map, XDP_PASS);
```

You also don't need `max_elem` to be `100`, there are only `5` possible actions (but it should work with `100` too).

**Comment by marshalWS** [comment]
> Thanks for the example, I didn't realize that maps could be pinned with `ip link set xdp`.
> 
> The only problem I can spot is that your program doesn't `tail_call` into the map. Instead of:
> 
> ```
>     return XDP_PASS;
> ```
> 
> You need to:
> 
> ```
> #include "hook.h"
> 
> ...
> 
>     return xdpcap_exit(ctx, &bpf_elf_map, XDP_PASS);
> ```
> 
> You also don't need `max_elem` to be `100`, there are only `5` possible actions (but it should work with `100` too).

thanks very much !  I get it.  xdpcap run successfully
Best wishes ~~.
root@xxx:/home/tecs/bin# ./xdpcap  /sys/fs/bpf/xdp/globals/action_map   dump-new.pcap
ws-----   os.Args[0]= ./xdpcap   [1:]= [/sys/fs/bpf/xdp/globals/action_map dump-new.pcap]
   ************   write packet pkt.data
aborted: 0/0    drop: 0/0       pass: 1/1       tx: 0/0 redirect: 0/0   (received/matched packets)
   ************   write packet pkt.data
aborted: 0/0    drop: 0/0       pass: 2/2       tx: 0/0 redirect: 0/0   (received/matched packets)
   ************   write packet pkt.data
aborted: 0/0    drop: 0/0       pass: 3/3       tx: 0/0 redirect: 0/0   (received/matched packets)
   ************   write packet pkt.data
aborted: 0/0    drop: 0/0       pass: 4/4       tx: 0/0 redirect: 0/0   (received/matched packets)
   ************   write packet pkt.data

**Comment by marshalWS** [comment]
This problem has been solved perfectly!
