### ISSUE TITLE
why  xdpcap can't  capture egress  traffic ?

### ISSUE THREAD

**Issue by unixisevil** [cloudflare/xdpcap#49]
i start  xdpcap  like this:
```bash
sudo -E env "PATH=$PATH"  xdpcap /sys/fs/bpf/hookmap -  'icmp[icmptype] = icmp-echo'   | tcpdump -n -r - 
```
then ping my machine(xdpcap running in this machine) from another machine , xdpcap does work:
```bash
reading from file -, link-type EN10MB (Ethernet)
18:40:48.100177 IP 192.168.254.10 > 192.168.254.29: ICMP echo request, id 8744, seq 1, length 64
18:40:49.101541 IP 192.168.254.10 > 192.168.254.29: ICMP echo request, id 8744, seq 2, length 64
18:40:50.103620 IP 192.168.254.10 > 192.168.254.29: ICMP echo request, id 8744, seq 3, length 64
18:40:51.107921 IP 192.168.254.10 > 192.168.254.29: ICMP echo request, id 8744, seq 4, length 64
18:40:52.122960 IP 192.168.254.10 > 192.168.254.29: ICMP echo request, id 8744, seq 5, length 64
18:40:53.124194 IP 192.168.254.10 > 192.168.254.29: ICMP echo request, id 8744, seq 6, length 64
```
but when i open  another terminal  on my machine:  
```bash
ping  1.1.1.1
``` 
xdpcap  capture nothing,  is there some way to capture egress traffic?

**Comment by arthurfabre** [comment]
XDP programs only run for ingress traffic, so `xdpcap` and your XDP program won't see egress traffic. 
There were proposals to support XDP egress (https://lwn.net/Articles/813406/), but I'm not sure what the status of it is.

**Comment by unixisevil** [comment]
@arthurfabre ， thanks for your reply,  i've googled this lwn article
